{
    "$schema": "http://json-schema.org/draft-07/schema#",
    "type": "object",
    "additionalProperties": false,
    "properties": {
        "logging_level": {
            "type": "string",
            "enum": [
                "debug",
                "info",
                "warn",
                "error"
            ],
            "description": "Log verbosity."
        },
        "operator_name": {
            "type": "string",
            "description": "Human-readable name published in the operator log list."
        },
        "operator_list_entries": {
            "type": "array",
            "items": {
                "type": "string",
                "format": "uri"
            },
            "default": [],
            "description": "Additional log metadata URLs published in the operator log list."
        },
        "logs": {
            "type": "object",
            "description": "Dictionary CT log shard names to configurations.",
            "additionalProperties": false,
            "patternProperties": {
                "^[a-z0-9]+$": {
                    "type": "object",
                    "additionalProperties": false,
                    "properties": {
                        "friendly_name": {
                            "type": "string",
                            "description": "Brief human-readable name for the log."
                        },
                        "intended_use": {
                            "description": "The operator's intended use for the log.",
                            "type": "string",
                            "enum": [
                                "production",
                                "test",
                                "decommissioned"
                            ]
                        },
                        "status": {
                            "type": "string",
                            "enum": [
                                "active",
                                "readonly",
                                "inactive"
                            ],
                            "description": "The intended operational state of the log."
                        },
                        "status_timestamp": {
                            "type": "string",
                            "format": "date-time",
                            "description": "When the current status was set."
                        },
                        "submission_endpoint": {
                            "$ref": "#/definitions/endpoint"
                        },
                        "monitoring_endpoint": {
                            "$ref": "#/definitions/endpoint"
                        },
                        "temporal_interval": {
                            "type": "object",
                            "additionalProperties": false,
                            "properties": {
                                "start_inclusive": {
                                    "type": "string",
                                    "format": "date-time",
                                    "description": "All certificates must expire on this date or later."
                                },
                                "end_exclusive": {
                                    "type": "string",
                                    "format": "date-time",
                                    "description": "All certificates must expire before this date."
                                }
                            },
                            "required": [
                                "start_inclusive",
                                "end_exclusive"
                            ]
                        },
                        "location_hint": {
                            "type": "string",
                            "description": "Provide a hint to place the log in a specific geographic location. See https://developers.cloudflare.com/durable-objects/reference/data-location/ for supported locations. If unspecified, the Durable Object will be created in proximity to the first request."
                        },
                        "sequence_interval_millis": {
                            "type": "integer",
                            "minimum": 100,
                            "default": 1000,
                            "description": "The duration in between sequencing operations, in milliseconds."
                        },
                        "max_sequence_skips": {
                            "type": "integer",
                            "minimum": 0,
                            "default": 0,
                            "description": "The maximum number of times sequencing can be skipped to avoid creating partial tiles. If non-zero, pending entries may be delayed by either a multiple of the sequence interval or sequence_skip_threshold_millis if set."
                        },
                        "sequence_skip_threshold_millis": {
                            "type": "integer",
                            "minimum": 0,
                            "description": "If provided, entries will only be skipped by sequencing (when max_sequenced_skips is non-zero) if they have been in the pool for less than this timeout."
                        },
                        "num_batchers": {
                            "type": "integer",
                            "minimum": 0,
                            "default": 8,
                            "maximum": 255,
                            "description": "The number of batchers to use to proxy requests to the sequencer. If zero, requests from the frontend worker go directly to the sequencer."
                        },
                        "batch_timeout_millis": {
                            "type": "integer",
                            "minimum": 100,
                            "default": 100,
                            "description": "The maximum duration to wait before submitting a batch to the sequencer, in milliseconds."
                        },
                        "max_batch_entries": {
                            "type": "integer",
                            "minimum": 1,
                            "default": 256,
                            "description": "The maximum number of entries per batch."
                        },
                        "enable_dedup": {
                            "type": "boolean",
                            "default": true,
                            "description": "Enables checking the deduplication cache for add-(pre-)chain requests. Can be disabled for tests and benchmarks. If disabled, `kv_namespaces` can be omitted from `wrangler.jsonc`."
                        },
                        "enable_ccadb_roots": {
                            "type": "boolean",
                            "default": true,
                            "description": "Enables loading root store trusted roots from the CCADB list, in addition to any roots configured in `roots.<env>.pem`. If enabled, requires a KV namespace with the binding `ccadb_roots` to be configured in `wrangler.jsonc`, as well as a cron trigger so that the CCADB list auto-updates. The CCADB cron job only ever appends roots to the list, but manual changes can be made if necessary."
                        },
                        "reject_expired": {
                            "type": "boolean",
                            "default": true,
                            "description": "Rejects submissions whose leaf certificate has expired."
                        },
                        "require_server_auth_eku": {
                            "type": "boolean",
                            "default": true,
                            "description": "Requires the leaf certificate to carry the id-kp-serverAuth extended key usage, per RFC 6962 \u00a73.1. Required for WebPKI logs, and the default. Set to false only to skip that presence check for a non-WebPKI log. False does not require a different EKU: leaves with another EKU or no EKU can be logged if every other chain and CT validation passes."
                        },
                        "clean_interval_secs": {
                            "type": "integer",
                            "minimum": 1,
                            "default": 60,
                            "description": "How long to wait in between runs of the partial tile cleaner. For static CT, the cleaner can clean 498 tiles (127,488 entries) per run before hitting the Workers limit of 1000 subrequests, so the default of once every 60 seconds should keep up with a log that grows at 2000 entries/second."
                        },
                        "include_in_operator_list": {
                            "type": "boolean",
                            "default": false,
                            "description": "Include this log's metadata URL in the operator log list."
                        }
                    },
                    "required": [
                        "friendly_name",
                        "intended_use",
                        "status",
                        "status_timestamp",
                        "temporal_interval",
                        "submission_endpoint",
                        "monitoring_endpoint"
                    ]
                }
            }
        }
    },
    "required": [
        "operator_name",
        "logs"
    ],
    "definitions": {
        "endpoint": {
            "type": "object",
            "additionalProperties": false,
            "properties": {
                "url": {
                    "type": "string",
                    "format": "uri"
                }
            },
            "required": [
                "url"
            ]
        }
    }
}
