{
    "logging_level": "info",
    "operator_name": "Cloudflare",
    "operator_list_entries": [
        "https://example.com/external-log/metadata.json"
    ],
    "logs": {
        "e2etestshard": {
            "friendly_name": "e2e test shard",
            "intended_use": "test",
            "status": "active",
            "status_timestamp": "2026-09-23T00:00:00Z",
            "submission_endpoint": { "url": "http://localhost:8787/logs/e2etestshard/" },
            "monitoring_endpoint": { "url": "http://localhost:8787/logs/e2etestshard/" },
            "temporal_interval": {
                "start_inclusive": "2026-01-01T00:00:00Z",
                "end_exclusive": "2076-01-01T00:00:00Z"
            },
            "location_hint": "enam"
        },
        "readonlytest": {
            "friendly_name": "read-only test shard",
            "intended_use": "test",
            "status": "readonly",
            "status_timestamp": "2026-09-23T00:00:00Z",
            "submission_endpoint": { "url": "http://localhost:8787/logs/readonlytest/" },
            "monitoring_endpoint": { "url": "http://localhost:8787/logs/readonlytest/" },
            "temporal_interval": {
                "start_inclusive": "2026-01-01T00:00:00Z",
                "end_exclusive": "2076-01-01T00:00:00Z"
            },
            "location_hint": "enam"
        },
        "dev2026h2a": {
            "friendly_name": "Dev 2026h2a",
            "intended_use": "test",
            "status": "active",
            "status_timestamp": "2026-07-01T00:00:00Z",
            "reject_expired": false,
            "submission_endpoint": { "url": "http://localhost:8787/logs/dev2026h2a/" },
            "monitoring_endpoint": { "url": "http://localhost:8787/logs/dev2026h2a/" },
            "temporal_interval": {
                "start_inclusive": "2026-07-01T00:00:00Z",
                "end_exclusive": "2027-01-01T00:00:00Z"
            },
            "max_sequence_skips": 1,
            "sequence_interval_millis": 750,
            "sequence_skip_threshold_millis": 250,
            "location_hint": "enam"
        },
        "dev2027h1a": {
            "friendly_name": "Dev 2027h1a",
            "intended_use": "test",
            "status": "active",
            "status_timestamp": "2026-09-23T00:00:00Z",
            "submission_endpoint": { "url": "http://localhost:8787/logs/dev2027h1a/" },
            "monitoring_endpoint": { "url": "http://localhost:8787/logs/dev2027h1a/" },
            "include_in_operator_list": true,
            "temporal_interval": {
                "start_inclusive": "2027-01-01T00:00:00Z",
                "end_exclusive": "2027-07-01T00:00:00Z"
            },
            "location_hint": "enam"
        },
        "dev2027h2a": {
            "friendly_name": "Dev 2027h2a",
            "intended_use": "test",
            "status": "active",
            "status_timestamp": "2026-09-23T00:00:00Z",
            "submission_endpoint": { "url": "http://localhost:8787/logs/dev2027h2a/" },
            "monitoring_endpoint": { "url": "http://localhost:8787/logs/dev2027h2a/" },
            "include_in_operator_list": true,
            "temporal_interval": {
                "start_inclusive": "2027-07-01T00:00:00Z",
                "end_exclusive": "2028-01-01T00:00:00Z"
            },
            "max_sequence_skips": 1,
            "sequence_interval_millis": 750,
            "sequence_skip_threshold_millis": 250,
            "location_hint": "enam"
        }
    }
}
